{
  "$schema": "urn:agent-machinery:schema:catalog:v1",
  "schema": "agent-machinery.catalog/v1",
  "package": {
    "name": "@tompassarelli/agent-machinery",
    "version": "0.1.0",
    "license": "MIT OR Apache-2.0"
  },
  "units": [
    {"id":"agent-machinery","kind":"module","source":"catalog.json","members":["agent-practice"]},
    {"id":"agent-practice","kind":"module","source":"catalog.json","members":["babashka-development","debugging","effect-development","external-code","planning","program-craftsmanship","rust-development","verification"]},
    {"id":"babashka-development","kind":"skill","source":"skills/babashka-development/SKILL.md"},
    {"id":"debugging","kind":"skill","source":"skills/debugging/SKILL.md"},
    {"id":"external-code","kind":"skill","source":"skills/external-code/SKILL.md"},
    {"id":"effect-development","kind":"skill","source":"skills/effect-development/SKILL.md"},
    {"id":"planning","kind":"skill","source":"skills/planning/SKILL.md"},
    {"id":"program-craftsmanship","kind":"skill","source":"skills/program-craftsmanship/SKILL.md"},
    {"id":"rust-development","kind":"skill","source":"skills/rust-development/SKILL.md"},
    {"id":"verification","kind":"skill","source":"skills/verification/SKILL.md"},
    {"id":"threejs","kind":"skill","source":"skills/threejs/SKILL.md"}
  ],
  "assets": [
    {"id":"agent-machinery-doctrine","type":"instructions","path":"doctrine.md"},
    {"id":"export-catalog-schema","type":"catalog","path":"catalog.schema.json"}
  ],
  "contracts": [
    {"id":"project-exposure-v1","schema":"contracts/project-exposure-profile.schema.json","schemaScope":"structural","fixtures":"contracts/project-exposure-profile.fixtures.json","validator":"validateContract"}
  ]
}
